{
  "id": "walters-26-2",
  "title": "Funerary Stele of Aurelia Artemis",
  "accession": "26.2",
  "date": "3rd–4th century CE (Late Antique)",
  "culture": [
    "Egypt"
  ],
  "collection": "Egyptian",
  "source_language": "Greek",
  "language": "English",
  "review": "unreviewed",
  "institution": "The Walters Art Museum",
  "source_url": "https://art.thewalters.org/object/26.2/",
  "metadata_url": "https://art.thewalters.org/object/26.2/",
  "retrieved_at": "2026-09-20",
  "metadata_sha256": "f8044680bd2fd9bf1fed2682197e0a95cd84bf0247fa8dd725dfaacd19f55df5",
  "text_license": "CC0",
  "image_license": "CC0",
  "text_rights_url": "https://thewalters.org/about/policies/rights-reproductions/",
  "image_rights_url": "https://thewalters.org/about/policies/rights-reproductions/",
  "image": "/curated/walters-26-2.jpg",
  "image_url": "https://art.thewalters.org/images/art/PL9_26.2_Fnt_SL_C80.jpg",
  "image_sha256": "fcfc14da51bee7aeaafeccb8255419a8e7f89a46229a5673a70539ca16a52471",
  "image_changes": "None; museum JPEG reproduced unchanged. The Walters Art Museum, CC0.",
  "text_changes": "Museum inscription field separated into translation, transcription and alternative rendering; wording preserved, HTML whitespace normalized. Longer description excluded.",
  "passages": [
    {
      "id": "walters-26-2-0",
      "field": "Inscription: Translation",
      "text": "Farewell Aurelia Artemis, Pasion’s daughter, incomparably sweetest among all.",
      "source_text": "Αὐρηλίαν Ἄρτεμειν θυγατέρα Πασίωνος τὴν γλυκυτάτην ἀσύνκριτον ἐν πᾶσι· εὐψύχι",
      "remark": ""
    }
  ],
  "source_snapshot": "/curated/sources/walters-26-2.json",
  "record_url": "/curated/walters-26-2.json",
  "note": "The museum supplies the Greek epitaph and its corresponding English rendering; the photograph shows the four-line epitaph below the figure. Egyptian geography, Greek language; no separate Mediterranean count. AncientLens scholarly review: unreviewed. Egypt, Akhmim (Place of Discovery). Ownership history: Dikran Kelekian, New York and Paris, by purchase; Henry Walters, Baltimore, 1923, by purchase; Walters Art Museum, 1931, by bequest.",
  "description": ""
}
