{
  "id": "cma-142026",
  "title": "Octodrachm: Head of Arsinoe II (obverse); Double Cornucopia (reverse)",
  "accession": "1965.552",
  "date": "205–145 BCE",
  "culture": [
    "Greek, Ptolemaic, minted at Alexandreia (Egypt), reign of Ptolemy V Epiphanes or Ptolemy VI Philometor"
  ],
  "collection": "Greek",
  "source_language": "Greek",
  "language": "English",
  "review": "unreviewed",
  "institution": "The Cleveland Museum of Art",
  "source_url": "https://www.clevelandart.org/art/1965.552",
  "metadata_url": "https://openaccess-api.clevelandart.org/api/artworks/142026",
  "retrieved_at": "2026-09-19T12:04:08.821305+00:00",
  "metadata_sha256": "a9fb2e08cdcfae2d4d7f575e5ddc98b64cecb05155dce5c7cb37792213138ac4",
  "text_license": "CC0",
  "image_license": "CC0",
  "text_rights_url": "https://openaccess-api.clevelandart.org/",
  "image_rights_url": "https://www.clevelandart.org/open-access",
  "image": "/curated/cma-142026.jpg",
  "image_url": "https://openaccess-cdn.clevelandart.org/1965.552/1965.552_web.jpg",
  "image_sha256": "d1c342bedec71099d59da17652f7a670e0ef011b87f168b3b720cec3f73dd32b",
  "image_changes": "None; museum web-sized JPEG",
  "text_changes": "None; translated fields and remarks reproduced verbatim",
  "passages": [
    {
      "id": "cma-142026-0",
      "field": "inscriptions[0].inscription_translation",
      "text": "Of father-loving Arsinoe",
      "source_text": "ΑΡΣΙΝΟΗΣ | ΦΙΛΑΔΕΛΦΟΥ",
      "remark": "Reverse"
    }
  ],
  "source_snapshot": "/curated/sources/cma-142026.json",
  "record_url": "/curated/cma-142026.json",
  "note": "",
  "description": ""
}
