{
  "id": "maya-vessel-k9271",
  "title": "Vessel K9271",
  "accession": "Vessel K9271",
  "date": "Date not catalogued",
  "culture": [
    "Maya; Mesoamerica"
  ],
  "collection": "Maya",
  "source_language": "Classic Mayan",
  "language": "English",
  "review": "unreviewed",
  "institution": "Sergei Vepretskii and Albert Davletshin — Research Note 22, Text Database and Dictionary of Classic Mayan",
  "source_url": "https://classicmayan.org/portal/doc/3",
  "metadata_url": "https://classicmayan.org/portal/doc/3",
  "retrieved_at": "2026-09-20T04:30:27.297042+00:00",
  "metadata_sha256": "0e6a0b6df2acde89193bc664367fcb6a2ae43aab6a20626f0612714fa5171445",
  "text_license": "CC BY 4.0",
  "image_license": "Not included",
  "text_rights_url": "https://creativecommons.org/licenses/by/4.0/",
  "image_rights_url": "",
  "image": "",
  "image_url": "",
  "image_sha256": "",
  "image_changes": "No image included; illustration reuse rights not established for this record.",
  "text_changes": "HTML markup removed and whitespace collapsed; wording and uncertainty preserved. No illustrations copied.",
  "passages": [
    {
      "id": "maya-vessel-k9271-0",
      "field": "Table 2, row 8; YAX-WEˀ-ne-CHAN-na-K’INICH (K9271)",
      "text": "As for the green color, it is (the sun god) K’ihnich who devours in the sky",
      "source_text": "Yax Weˀen Chan K’ihnich",
      "remark": "Short name excerpt. Attribution: Sergei Vepretskii and Albert Davletshin, Research Note 22."
    }
  ],
  "source_snapshot": "/curated/sources/maya-vessel-k9271.json",
  "record_url": "/curated/maya-vessel-k9271.json",
  "note": "Short name excerpt; not a full translation of the object/document. Published interpretation, unreviewed by AncientLens. Question marks, gaps and alternative readings are retained. Exact findspot not established in this release. Image-to-text alignment is unavailable; no image included.",
  "description": ""
}
