{
  "id": "maya-vessel-k4669",
  "title": "Vessel K4669",
  "accession": "Vessel K4669",
  "date": "Date not catalogued",
  "culture": [
    "Maya; Mesoamerica"
  ],
  "collection": "Maya",
  "source_language": "Classic Mayan",
  "language": "English",
  "review": "unreviewed",
  "institution": "Sergei Vepretskii and Albert Davletshin — Research Note 22, Text Database and Dictionary of Classic Mayan",
  "source_url": "https://classicmayan.org/portal/doc/3",
  "metadata_url": "https://classicmayan.org/portal/doc/3",
  "retrieved_at": "2026-09-20T04:30:27.297042+00:00",
  "metadata_sha256": "53feb935d9a8bb3a902ebf389ec4d04d4b891d68019ed8668919c119eb5452ba",
  "text_license": "CC BY 4.0",
  "image_license": "Not included",
  "text_rights_url": "https://creativecommons.org/licenses/by/4.0/",
  "image_rights_url": "",
  "image": "",
  "image_url": "",
  "image_sha256": "",
  "image_changes": "No image included; illustration reuse rights not established for this record.",
  "text_changes": "HTML markup removed and whitespace collapsed; wording and uncertainty preserved. No illustrations copied.",
  "passages": [
    {
      "id": "maya-vessel-k4669-0",
      "field": "Table 3, row 3; CHAK-HOP-la-ja-CHAN-na-YOPAT-ti (K4669)",
      "text": "As for the red color, it is (the rain god) Yopˀaat who is burning in the sky",
      "source_text": "Chak Hoplaj Chan Yopˀaat",
      "remark": "Short name excerpt. Attribution: Sergei Vepretskii and Albert Davletshin, Research Note 22."
    }
  ],
  "source_snapshot": "/curated/sources/maya-vessel-k4669.json",
  "record_url": "/curated/maya-vessel-k4669.json",
  "note": "Short name excerpt; not a full translation of the object/document. Published interpretation, unreviewed by AncientLens. Question marks, gaps and alternative readings are retained. Exact findspot not established in this release. Image-to-text alignment is unavailable; no image included.",
  "description": ""
}
