{
  "id": "maya-ccit-vaso-8",
  "title": "CCIT Vaso #8",
  "accession": "CCIT Vaso #8",
  "date": "8th century CE",
  "culture": [
    "Maya; Mesoamerica"
  ],
  "collection": "Maya",
  "source_language": "Classic Mayan",
  "language": "English",
  "review": "unreviewed",
  "institution": "Guido Krempel, Sebastián Matteo and Dmitri Beliaev — Research Note 23, Text Database and Dictionary of Classic Mayan",
  "source_url": "https://classicmayan.org/portal/doc/84",
  "metadata_url": "https://classicmayan.org/portal/doc/84",
  "retrieved_at": "2026-09-20T04:30:27.297042+00:00",
  "metadata_sha256": "f2832de623a2160a4cb68c2a9c281a3adf9cf9c8e476df085a4ddbf659de1160",
  "text_license": "CC BY 4.0",
  "image_license": "CC BY 4.0",
  "text_rights_url": "https://creativecommons.org/licenses/by/4.0/",
  "image_rights_url": "https://classicmayan.org/portal/doc/84",
  "image": "/curated/maya-ccit-vaso-8.jpg",
  "image_url": "https://classicmayan.org/portal/editor/uploads/1037_254_10371_rn_23_figure-3_yax-ween-tikal-bodega-vessel_draw_gk2019_low_jpg-scaled_scaled.jpg",
  "image_sha256": "b47e997de233806c92388a787980b6b092a3172129d67ff5f86aaa37185681fb",
  "image_changes": "Scholarly drawing by Guido Krempel (2019), Figure 3, Research Note 23. CC BY 4.0; publisher web image reproduced without changes. This is a drawing, not a photograph.",
  "text_changes": "HTML markup removed and whitespace collapsed; original translation wording and uncertainty preserved. Drawing separately credited.",
  "passages": [
    {
      "id": "maya-ccit-vaso-8-0",
      "field": "A cylindrical vessel mentioning Ix Yax We’n Chaak; dedicatory text",
      "text": "It got sanctified? (it got raised?) the painted drinking cup for fruity cocoa (of) yo?[…] […] Ix Yax We’n Chaak, sovereign of Baax Witz, chief of the land",
      "source_text": "",
      "remark": "Published dedicatory rendering, with source uncertainties and missing passages retained. Guido Krempel, Sebastián Matteo and Dmitri Beliaev — Research Note 23, Text Database and Dictionary of Classic Mayan"
    }
  ],
  "source_snapshot": "/curated/sources/maya-ccit-vaso-8.json",
  "record_url": "/curated/maya-ccit-vaso-8.json",
  "note": "Published edition of the surviving dedicatory inscription; damaged text and proposed reconstructions remain marked. All twelve positions of the published dedicatory inscription are covered by the source edition; badly abraded and missing positions remain unresolved. AncientLens review remains unreviewed. The drawing is an interpretive representation; alignment is unverified. Source attributes the vessel to Xultun workshops; actual findspot unknown. Held at CCIT, Tikal according to the publication.",
  "description": ""
}
