{
  "id": "cma-98332",
  "title": "Tetradrachm: Head of Apollo (obverse); Head of Lion (reverse)",
  "accession": "1917.988",
  "date": "466–422 BCE",
  "culture": [
    "Greek, minted at Leontinoi (Sicily)"
  ],
  "collection": "Greek",
  "source_language": "Greek",
  "language": "English",
  "review": "unreviewed",
  "institution": "The Cleveland Museum of Art",
  "source_url": "https://www.clevelandart.org/art/1917.988",
  "metadata_url": "https://openaccess-api.clevelandart.org/api/artworks/98332",
  "retrieved_at": "2026-09-19T12:04:08.821305+00:00",
  "metadata_sha256": "8723cd1d90da4122b32eab8131b20f970479ba800296fc89dc26dee36d4f0a08",
  "text_license": "CC0",
  "image_license": "CC0",
  "text_rights_url": "https://openaccess-api.clevelandart.org/",
  "image_rights_url": "https://www.clevelandart.org/open-access",
  "image": "/curated/cma-98332.jpg",
  "image_url": "https://openaccess-cdn.clevelandart.org/1917.988/1917.988_web.jpg",
  "image_sha256": "bc0e0e4ceb489f8a426a4d717e4f5486977ff036f70c65bf9de4bfac1ad82ddf",
  "image_changes": "None; museum web-sized JPEG",
  "text_changes": "None; translated fields and remarks reproduced verbatim",
  "passages": [
    {
      "id": "cma-98332-0",
      "field": "inscriptions[0].inscription_translation",
      "text": "Of the people of Leontinoi",
      "source_text": "[ΛΕ]Ο[ΝΤ]ΙΝΟΝ",
      "remark": "Reverse"
    }
  ],
  "source_snapshot": "/curated/sources/cma-98332.json",
  "record_url": "/curated/cma-98332.json",
  "note": "",
  "description": ""
}
