{
  "id": "maya-naranjo-stela-46",
  "title": "Naranjo Stela 46",
  "accession": "Naranjo Stela 46",
  "date": "Date not catalogued",
  "culture": [
    "Maya; Mesoamerica"
  ],
  "collection": "Maya",
  "source_language": "Classic Mayan",
  "language": "English",
  "review": "unreviewed",
  "institution": "Sergei Vepretskii and Albert Davletshin — Research Note 22, Text Database and Dictionary of Classic Mayan",
  "source_url": "https://classicmayan.org/portal/doc/3",
  "metadata_url": "https://classicmayan.org/portal/doc/3",
  "retrieved_at": "2026-09-20T04:30:27.297042+00:00",
  "metadata_sha256": "12f198c9d060db72402d9be892bc5a5199f0e90254c73cd4410bd11c5f9347de",
  "text_license": "CC BY 4.0",
  "image_license": "Not included",
  "text_rights_url": "https://creativecommons.org/licenses/by/4.0/",
  "image_rights_url": "",
  "image": "",
  "image_url": "",
  "image_sha256": "",
  "image_changes": "No image included; illustration reuse rights not established for this record.",
  "text_changes": "HTML markup removed and whitespace collapsed; wording and uncertainty preserved. No illustrations copied.",
  "passages": [
    {
      "id": "maya-naranjo-stela-46-0",
      "field": "Table 2, row 6; MUYAL-ya-la-KAL-ni-CHAN-na-YOP-ˀAT-ti (Naranjo Stela 46: A14-B14) MUYAL-la-KAL-CHAN-na-YOP-ˀAT (Naranjo Stela 13: G9-G10)",
      "text": "As for the cloud, it is (the rain god) Yopˀaat who chops? in the sky",
      "source_text": "Muyaal Kalaan Chan Yopˀaat",
      "remark": "Short name excerpt. Attribution: Sergei Vepretskii and Albert Davletshin, Research Note 22."
    }
  ],
  "source_snapshot": "/curated/sources/maya-naranjo-stela-46.json",
  "record_url": "/curated/maya-naranjo-stela-46.json",
  "note": "Short name excerpt; not a full translation of the object/document. Published interpretation, unreviewed by AncientLens. Question marks, gaps and alternative readings are retained. Exact findspot not established in this release. Image-to-text alignment is unavailable; no image included.",
  "description": ""
}
